,id,created_unix_utc,post_url,post_title,flair,score,num_comments,upvote_ratio
71,p674t2,1629217199.0,https://www.newscientist.com/article/2287207-tiny-human-brain-grown-in-lab-has-eye-like-structures-that-see-light/,"Small blobs of human brain grown in a dish have been coaxed into forming rudimentary eyes, which respond to light by sending signals to the rest of the brain tissue.",Biology,78199,3880,0.92
72,dj4z87,1571311367.0,https://www.washingtonpost.com/health/teen-suicides-increasing-at-alarming-pace-outstripping-all-other-age-groups/2019/10/16/e24194c6-f04a-11e9-8693-f487e46784aa_story.html,"From 2007 to 2017, the number of suicides among people ages 10 to 24 increased 56 percent",Epidemiology,78137,6398,0.94
73,ex5rf3,1580561810.0,https://www.cnet.com/news/pablo-escobars-hippos-have-become-an-invasive-species-in-colombia/,Pablo Escobar's hippos have become an invasive species in Colombia,Environment,77632,2766,0.93
74,ljndks,1613304976.0,https://academictimes.com/vulnerable-democratic-governors-overcompensate-on-crime/,"Democratic governors who win office by thin margins lock more people up and spend more money on jails and prisons than their Republican counterparts, according to new research, a finding that exposes some Democrats’ “complicity” in the rapid growth of institutions designed to punish criminals.",Social Science,77583,3459,0.75
75,e61p2u,1575476921.0,https://www.newsweek.com/breast-cancer-linked-permanent-hair-dye-chemical-hair-straighteners-study-almost-50000-women-1475328,"Breast cancer linked to permanent hair dye and chemical hair straighteners in study of almost 50,000 women",Medicine,77390,1872,0.9
76,kxrjx2,1610704748.0,https://pressroom.usc.edu/covid-19-reduced-u-s-life-expectancy-especially-among-black-and-latino-populations/,"The COVID-19 pandemic, which claimed more than 336,000 lives in the United States in 2020, has significantly affected life expectancy. Life expectancy at birth for Americans will shorten by 1.13 years to 77.48 years. That is the largest single-year decline in life expectancy in at least 40 years.",Health,77346,2277,0.83
77,gs7wb5,1590678312.0,https://www.aeaweb.org/articles?id=10.1257/aer.20180501,"In 2009, the Obama Administration began issuing press releases naming facilities that violate OSHA safety and health regulations. This naming and shaming led other facilities to substantially improve their compliance and experience fewer work injuries. The Trump administration ended the practice.",Social Science,77101,1372,0.82
78,bp4esa,1557958457.0,http://blogs.discovermagazine.com/d-brief/2019/05/15/some-corals-in-hawaii-thrive-in-warm-acidic-water/#.XNyNnZNKhTY,"Scientists have found ""supercorals"" in Hawaii’s Kāne’ohe Bay, where a reef is thriving despite development, dredging, sewage and high temperatures. In the lab, the corals also withstood simulated climate change, including rising acidity and temps. The find could offer hope for the future of corals.",Biology,76921,1621,0.95
79,fabd6r,1582806473.0,https://apnews.com/a2154b643d53afae2a3654f722a9b60a,"About 40% of US adults are obese, government survey finds",Health,76631,10565,0.92
80,cgy0b3,1563913762.0,https://news.uoguelph.ca/2019/07/u-of-g%E2%80%AFresearchers-first-to-unlock-access-to-pain%E2%80%AFrelief%E2%80%AFpotential-of-cannabis%E2%80%AF/,Researchers first to uncover how the cannabis plant creates important pain-relieving molecules that are 30 times more powerful at reducing inflammation than Aspirin. The discovery unlocks the potential to create a naturally derived pain treatment for relief of acute and chronic pain beyond opioids.,Medicine,76475,1390,0.87
81,aqqni1,1550190010.0,https://www.inverse.com/article/53324-night-owls-morning-larks-study,"People who are ""night owls"" and those who are ""morning larks"" have a fundamental difference in brain function. This difference is why we should rethink the 9-to-5 workday, say researchers.",Neuroscience,76399,4337,0.84
82,jm1vii,1604235791.0,https://ethz.ch/en/news-and-events/eth-news/news/2020/10/workplace-interruptions-lead-to-physical-stress.html,"Researchers have showed for the first time that the body produces more stress hormones when people are repeatedly interrupted at work. Should this stress become chronic, it can lead to states of exhaustion that have a negative impact on public health and carry a significant economic cost.",Psychology,76207,2228,0.93
83,kr8mdl,1609883082.0,https://showme.missouri.edu/2021/facebook-posts-help-facilitate-belief-that-hpv-vaccine-is-dangerous-to-health/,"Despite more than 12 years of data supporting HPV vaccine being safe and effective against genital warts and cancer, a new study found that Facebook posts help facilitate the belief that HPV vaccine is dangerous to health, with nearly 40% of posts about HPV vaccine amplifying a perceived risk.",Health,76179,2586,0.89
84,jqizd2,1604867622.0,https://www.psypost.org/2020/11/singles-who-are-satisfied-with-their-friends-are-less-likely-to-desire-a-relationship-partner-58488,Singles who are satisfied with their friends are less likely to desire a relationship partner,Psychology,76165,1953,0.88
85,8si2i9,1529499322.0,https://news.stanford.edu/2018/06/18/find-passion-may-bad-advice/,"Instead of ‘finding your passion,’ try developing it, Stanford scholars say. The belief that interests arrive fully formed and must simply be “found” can lead people to limit their pursuit of new fields and give up when they encounter challenges, according to a new Stanford study.",Psychology,75799,1353,0.91
86,rgekj2,1639508472.0,https://edition.cnn.com/2021/12/13/health/logic-song-suicide-prevention-wellness/index.html,"Logic's song '1-800-273-8255' saved lives from suicide, study finds. Calls to the suicide helpline soared by 50% with over 10,000 more calls than usual, leading to 5.5% drop in suicides among 10 to 19 year olds — that's about 245 less suicides than expected within the same period",Health,75687,1233,0.9
87,bpaxoj,1558003079.0,https://www.eurekalert.org/pub_releases/2019-05/nuos-ptl051319.php,"Men initiate sex more than three times as often as women do in a long-term, heterosexual relationship. However, sex happens far more often when the woman takes the initiative, suggesting it is the woman who sets limits, and passion plays a significant role in sex frequency, suggests a new study.",Psychology,75671,5740,0.87
88,i7a3dx,1597082966.0,https://www.inverse.com/innovation/sunlight-powered-clean-water,"A team of chemical engineers from Australia and China has developed a sustainable, solar-powered way to desalinate water in just 30 minutes. This process can create close to 40 gallons of clean drinking water per kilogram of filtration material and can be used for multiple cycles.",Engineering,75661,1336,0.94
89,7rqans,1516453827.0,https://www.binghamton.edu/news/story/938/using-fungi-to-fix-bridges,"Binghamton University researchers have been working on a self-healing concrete that uses a specific type of fungi as a healing agent. When the fungus is mixed with concrete, it lies dormant until cracks appear, when spores germinate, grow and precipitate calcium carbonate to heal the cracks.",Engineering,75409,1209,0.9
90,6se104,1502204390.0,http://www.chron.com/news/health/article/Teen-birth-rates-spiked-in-Texas-after-Planned-11283376.php,Teen birth rates spiked in Texas after funding for family planning services was reduced by 67% in 2011,Health,75214,5104,0.76
91,yt4yf8,1668253952.0,https://news.yale.edu/2022/07/05/insulin-extreme-financial-burden-over-14-americans-who-use-it,"For more than 14% of people who use insulin in the U.S., insulin costs consume at least 40% of their available income, a new study finds",Health,75008,2580,0.93
92,bdtb0j,1555417439.0,http://news.chicagobooth.edu/newsroom/new-study-finds-simple-way-inoculate-teens-against-junk-food-marketing,"New study finds simple way to inoculate teens against junk food marketing when tapping into teens’ desire to rebel, by framing corporations as manipulative marketers trying to hook consumers on addictive junk food for financial gain. Teenage boys cut back junk food purchases by 31%.",Health,74916,2427,0.92
93,bpqf9m,1558094832.0,https://www.inverse.com/article/55918-lsd-psilocybin-alcohol-addiction-stop,"After taking LSD or psilocybin, 83 percent of alcoholics no longer met the criteria for the disorder, and 28 percent credited their psychedelic experience for their lifestyle change.",Medicine,74827,2007,0.88
94,m1v1pf,1615374045.0,https://www.nature.com/articles/d41586-021-00587-x,Cannabis production is generating large amounts of gases that heat up Earth’s physical climate. Moving weed production from indoor facilities to greenhouses and the great outdoors would help to shrink the carbon footprint of the nation’s legal cannabis industry.,Environment,74765,3190,0.78
95,7a2pmo,1509532007.0,https://www.theguardian.com/science/head-quarters/2017/oct/31/the-reminiscence-bump-why-americas-greatest-year-was-probably-when-you-were-young,"In a new study, Americans disproportionately chose the years of their own youth as the country’s greatest years – no matter how old they were now. This finding is the latest involving a phenomenon known as the reminiscence bump.",Psychology,74750,4431,0.84
96,7ps5os,1515711945.0,https://www.wired.com/story/scientists-discover-clean-water-ice-just-below-mars-surface/,Scientists Discover Clean Water Ice Just Below Mars' Surface,Astronomy,74593,2333,0.92
97,i8p24t,1597275840.0,https://news.osu.edu/young-children-would-rather-explore-than-get-rewards/,"Young children would rather explore than get rewards, a study of American 4- and 5 year-olds finds. And their exploration is not random: the study showed children approached exploration systematically, to make sure they didn’t miss anything.",Psychology,74330,1115,0.95
98,aevffo,1547213766.0,https://thriveworks.com/blog/parents-successfully-cut-back-childs-screen-time/,"Researchers say if parents want to successfully cut back on their child’s screen-time, they must first cut back on screen-time themselves",Psychology,74235,1942,0.9
99,ren6cc,1639308430.0,https://www.japantimes.co.jp/news/2021/12/12/national/science-health/aging-vaccine/,"Japanese scientists create vaccine for aging to eliminate aged cells, reversing artery stiffening, frailty, and diabetes in normal and accelerated aging mice",Biology,74211,2097,0.92
