,id,created_unix_utc,post_url,post_title,flair,score,num_comments,upvote_ratio
73,riclhg,1639728332.0,https://uwaterloo.ca/news/media/private-equity-long-term-care-homes-have-highest-mortality,Nursing homes with the highest profit margins have the lowest quality. The Covid-19 pandemic revealed that for-profit long-term care homes had worse patient outcomes than not-for-profit homes. Long-term care homes owned by private equity firms and large chains have the highest mortality rates.,Economics,49527,1532,0.94
74,xyxak7,1665247293.0,https://www.abdn.ac.uk/news/16424/,"Babies have air pollution in their lungs and brains before they take their first breath. Nanoparticles cross the placenta into the foetus in the womb as early as the first trimester of pregnancy and get into its developing organs, including its liver, lungs, and brain.",Health,49390,1686,0.92
75,vnd35o,1656500444.0,https://www.psu.edu/news/research/story/humans-cant-endure-temperatures-and-humidities-high-previously-thought/,Humans can't endure temperatures and humidities as high as previously thought.,Health,49276,2904,0.9
76,te89pc,1647293218.0,https://onlinelibrary.wiley.com/doi/10.1111/ajps.12702,Exposure to “rags-to-riches” TV programs make Americans more likely to believe in upward mobility and the narrative of the American Dream. The prevalence of these TV shows may explain why so many Americans remain convinced of the prospects for upward mobility.,Social Science,48988,2483,0.83
77,vgy1xj,1655765120.0,https://www.upi.com/Health_News/2022/06/20/prescription-drug-prices-Mark-Cuban-study/5901655755138/,Medicare could have saved an estimated $3.6 billion buying generic drugs at Mark Cuban's direct-to-consumer online pharmacy according to an analysis of 89 drugs available for purchase on the platform.,Medicine,48952,1263,0.92
78,s9bd7c,1642773627.0,https://www.aeaweb.org/research/inversions-us-presidential-elections-geruso,"Only four times in US presidential history has the candidate with fewer popular votes won. Two of those occurred recently, leading to calls to reform the system. Far from being a fluke, this peculiar outcome of the US Electoral College has a high probability in close races, according to a new study.",Economics,48837,4487,0.8
79,x7c5gg,1662474812.0,https://www.cambridge.org/core/journals/american-political-science-review/article/abs/democratic-state-and-redistribution-whose-interests-are-served/5825BF63006FBBF5C741CE9C7C9DEE3F#article,"In 16 out of 17 advanced democracies, governments have increased economic redistribution to compensate the middle and lower classes amid growing economic inequality. This contradicts claims that governments are unresponsive to popular demands. The one exception is the United States.",Social Science,48526,1709,0.84
80,ulnjog,1652089533.0,https://news.mit.edu/2022/study-immigrants-more-likely-start-firms-create-jobs-0509,"Study: Immigrants in the U.S. are more likely to start firms, create jobs. Compared to native-born citizens, immigrants are more frequently involved in founding companies at all scales.",Social Science,48210,1579,0.84
81,vtjz6d,1657204130.0,https://www.zmescience.com/science/myrkl-new-anti-hangover-pill-said-to-break-down-up-to-70-of-alcohol-in-an-hour-what-you-need-to-know/,Myrkl: new anti-hangover pill said to break down up to 70% of alcohol in an hour,Medicine,47931,2642,0.83
82,v2ndcz,1654107048.0,https://www.sciencenews.org/article/covid-dog-detection-pcr-test-screening-coronavirus?utm_source=Reddit&utm_medium=social&utm_campaign=r_science,"Trained dogs sniff out COVID-19 as well as lab tests do, and the canines are even better than PCR tests at identifying infected people with no symptoms.",Medicine,47281,875,0.91
83,siuxc9,1643824142.0,https://news.mit.edu/2022/polymer-lightweight-material-2d-0202,"Engineers have created a new material that is stronger than steel and as light as plastic, and can be easily manufactured in large quantities. New material is a two-dimensional polymer that self-assembles into sheets, unlike all other one-dimensional polymers.",Materials Science,47155,2165,0.91
84,xx2mtq,1665054782.0,https://www.psypost.org/2022/10/unwanted-celibacy-is-linked-to-hostility-towards-women-sexual-objectification-of-women-and-endorsing-rape-myths-64003,"Unwanted celibacy is linked to hostility towards women, sexual objectification of women, and endorsing rape myths",Psychology,46870,7694,0.76
85,rz6og4,1641667294.0,https://www.eurekalert.org/news-releases/939595,"Women vaccinated against COVID-19 transfer SARS-CoV-2 antibodies to their breastfed infants, potentially giving their babies passive immunity against the coronavirus. The antibodies were detected in infants regardless of age – from 1.5 months old to 23 months old.",Health,46783,1337,0.87
86,xeye6n,1663252483.0,https://www.psypost.org/2022/09/pornography-might-serve-as-a-means-of-existential-escape-among-those-suffering-from-boredom-63907,Pornography might serve as a means of existential escape among those suffering from boredom,Psychology,46320,2148,0.78
87,sn8brf,1644286912.0,https://www.psypost.org/2022/02/psilocybin-microdosing-does-not-reduce-symptoms-of-depression-or-anxiety-according-to-placebo-controlled-study-62495,"Consuming small doses of psilocybin at regular intervals — a process known as microdosing — does not appear to improve symptoms of depression or anxiety, according to new research.",Medicine,46219,3057,0.81
88,urr5wa,1652807319.0,https://norml.org/blog/2022/05/17/study-young-adults-consumption-of-alcohol-cigarettes-other-substances-fell-following-marijuana-legalization/,"Study: Young Adults' Consumption of Alcohol, Cigarettes, Other Substances Fell Following Marijuana Legalization",Health,45973,1560,0.91
89,t77kht,1646479769.0,https://www.psu.edu/news/story/humans-cant-endure-temperatures-and-humidities-high-previously-thought/,"Humans can't endure temperatures and humidities as high as previously thought. The actual maximum wet-bulb temperature is lower — about 31°C wet-bulb or 87°F at 100% humidity — even for young, healthy subjects. The temperature for older populations, is likely even lower.",Environment,45887,2621,0.92
90,slq0p4,1644129166.0,https://alz-journals.onlinelibrary.wiley.com/doi/10.1002/alz.12558,"The brains of patients who died as a result of COVID-19 infection displayed some of the same molecular changes found in the brains of those with Alzheimer’s disease, a new small study found. The findings may explain why some long-term COVID sufferers report memory problems.",Neuroscience,45789,1661,0.89
91,rnq3az,1640364739.0,https://news.mit.edu/2021/tup-people-poverty-decade-1222,A field experiment in India led by MIT antipoverty researchers has produced a striking result: A one-time boost of capital improves the condition of the very poor even a decade later.,Economics,45700,1263,0.93
92,yc3jwl,1666591230.0,https://newatlas.com/telecommunications/optical-chip-fastest-data-transmission-record-entire-internet-traffic/,"Record-breaking chip can transmit entire internet's traffic per second. A new photonic chip design has achieved a world record data transmission speed of 1.84 petabits per second, almost twice the global internet traffic per second.",Physics,45667,1739,0.94
93,vecma2,1655470798.0,https://www.psypost.org/2022/06/exposure-to-humorous-memes-about-anti-vaxxers-boosts-intention-to-get-a-covid-19-vaccine-study-finds-63336,"Exposure to humorous memes about anti-vaxxers boosts intention to get a COVID-19 vaccine, study finds",Psychology,45424,1758,0.78
94,un61n7,1652261927.0,https://www.eurekalert.org/news-releases/952272,"Neoliberalism, which calls for free-market capitalism, regressive taxation, and the elimination of social services, has resulted in both preference and support for greater income inequality over the past 25 years,",Psychology,45161,4322,0.72
95,vi5pjy,1655905745.0,https://science.ku.dk/english/press/news/2022/the-case-for-speaking-politely-to-animals/,"How we speak matters to animals. Horses, pigs and wild horses can distinguish between negative and positive sounds from their fellow species and near relatives, as well as from human speech, according to new research in behavioral biology at the University of Copenhagen.",Animal Science,44769,1202,0.93
96,slb8up,1644079487.0,https://www.gaytimes.co.uk/life/gay-and-lesbian-adults-have-higher-covid-19-vaccination-rates-than-heterosexual-counterparts-study-finds/,"Gay and lesbian adults have higher COVID-19 vaccination rates than heterosexual counterparts, study finds",Social Science,44733,3744,0.65
97,xbq3sl,1662921617.0,https://www.kcl.ac.uk/news/going-with-the-flow-study-shows-canals-help-boost-your-mood,Spending time by canals and rivers is linked to feeling happy and healthy,Psychology,44672,840,0.92
98,u8cf44,1650506115.0,https://news.tulane.edu/pr/tulane-study-explores-academic-success-among-jewish-girls,"Girls raised by Jewish parents are 23 percentage points more likely to graduate from college than those with a non-Jewish upbringing, even after accounting for their parents’ socioeconomic status, research finds. They tend to ""articulate a self-concept marked by ambitious career goals.""",Social Science,44622,3626,0.77
99,rk1axq,1639934728.0,https://news.asu.edu/20211217-protective-effect-education-against-midlife-depression-waning-americans,"American adults currently in their 40s, 50s and early 60s have more symptoms of depression and worse memory recall than older Americans did when they were the same age",Psychology,44534,2102,0.93
