,id,created_unix_utc,post_url,post_title,flair,score,num_comments,upvote_ratio
0,84aiy6,1521000374.0,https://www.reddit.com/r/science/comments/84aiy6/physicist_stephen_hawking_dies_aged_76/,Physicist Stephen Hawking dies aged 76,Breaking News,199299,3849,0.92
1,bblu6v,1554901897.0,https://www.sciencenews.org/article/black-hole-first-picture-event-horizon-telescope?utm_source=reddit&utm_medium=social&utm_campaign=r_science,The first picture of a black hole opens a new era of astrophysics. The supermassive beast lies in a galaxy called M87 more than 50 million light-years away,Physics,155292,5536,0.95
2,90adse,1532038912.0,https://www.google.com/amp/s/www.washingtonpost.com/amphtml/business/2018/07/18/does-legal-weed-make-police-more-effective/,"Since legalizing cannabis in 2012, crime clearance rates are increasing faster in Washington and Colorado than the rest of country, suggesting that legalization may free police to focus on more serious crimes.",Social Science,124696,4758,0.89
3,7e1jo1,1511108647.0,https://www.reddit.com/r/science/comments/7e1jo1/raising_the_taxes_of_graduate_students_by_as_much/,Raising the taxes of graduate students by as much as 300% will be a disaster for the USA,Subreddit Discussion,124373,10930,0.81
4,yql2u5,1668005455.0,https://www.psypost.org/2022/11/attractive-female-students-no-longer-earned-higher-grades-when-classes-moved-online-during-covid-19-64251,Attractive female students no longer earned higher grades when classes moved online during COVID-19,Psychology,123353,4073,0.8
5,7s6a9z,1516633319.0,https://www.york.ac.uk/news-and-events/news/2018/research/no-evidence-to-link-violence-and-video-games/,No evidence to support link between violent video games and behaviour - Researchers at the University of York have found no evidence to support the theory that video games make players more violent.,Psychology,114568,3795,0.87
6,kd67rx,1607978957.0,https://aftau.org/news_item/led-lights-found-to-kill-coronavirus-global-first-in-fight-against-covid-19/,"LED lights found to kill coronavirus efficiently, quickly, and cheaply, a global first in fight against COVID-19. The finding suggests the UV-LEDs can be installed in air conditioning and water systems. It requires less than half a minute to destroy more than 99.9% of coronaviruses.",Medicine,114433,3534,0.9
7,lad9pe,1612211502.0,https://journals.sagepub.com/doi/full/10.1177/0038038520982225,"Wealthy, successful people from privileged backgrounds often misrepresent their origins as working-class in order to tell a ‘rags to riches’ story resulting from hard work and perseverance, rather than social position and intergenerational wealth.",Psychology,113723,3159,0.78
8,7gn1ne,1512055388.0,https://motherboard.vice.com/en_us/article/vbz49j/new-study-finds-that-most-redditors-dont-actually-read-the-articles-they-vote-on,New study finds that most redditors don’t actually read the articles they vote on.,Social Science,110990,4553,0.81
9,lwuvpc,1614780956.0,https://doi.org/10.1177/2378023121996854,"Casual sex among young adults has declined due to decline in drinking, an increase in computer gaming, and more young adults living with their parents.",Social Science,110662,9558,0.89
10,dei73a,1570448099.0,https://www.realclearscience.com/quick_and_clear_science/2019/10/07/painting_zebra_stripes_on_cows_wards_off_biting_flies.html,"Scientists believe that the function of zebras' stripes are to deter insects, so a team of researchers painted black and white stripes on cows. They found that it reduced the number of biting flies landing on the cows by more than 50%.",Animal Science,109327,2037,0.96
11,k1ofcu,1606428305.0,https://www.sciencedirect.com/science/article/abs/pii/S0047272720301493,"In the US, states typically pay for prison while counties determine sentencing. A natural experiment whereby the cost burden of juvenile incarceration was placed on counties led to a stark drop in incarceration. This suggests that mass incarceration in the US is in part due to misaligned incentives.",Social Science,106100,1817,0.91
12,l1work,1611228462.0,https://www.eurekalert.org/pub_releases/2021-01/nrco-ccb011821.php,"Korean scientists developed a technique for diagnosing prostate cancer from urine within only 20 minutes with almost 100% accuracy, using AI and a biosensor, without the need for an invasive biopsy. It may be further utilized in the precise diagnoses of other cancers using a urine test.",Cancer,104792,1150,0.93
13,cs072c,1566128489.0,https://www.newscientist.com/article/2213655-having-kids-makes-you-happier-but-only-when-they-move-out/,"Having kids makes you happier, but only when they move out, according to a new study, which suggests that parents are happier than non-parents later in life, when their children move out and become sources of social enjoyment rather than stress (n=55,000).",Psychology,104593,4021,0.9
14,mwtdiq,1619178214.0,https://academictimes.com/scientists-find-new-evidence-linking-essential-oils-to-seizures/,"Scientists find new evidence linking essential oils to seizures: Analyzing 350 seizure cases, researchers found that 15.7% of seizures may have been induced by inhalation, ingestion or topical use of essential oils. After stopping use of oils, the vast majority did not experience another seizure.",Neuroscience,104436,3648,0.91
15,b6hy7e,1553774691.0,https://www.independent.co.uk/news/health/healing-powers-no-pain-mutant-gene-scotland-a8842836.html,"Woman with ‘mutant’ gene who feels no pain and heals without scarring discovered by scientists. She reported numerous burns and cuts without pain, often smelling her burning flesh before noticing any injury, as published in the British Journal of Anaesthesia, and could open door to new treatments.",Medicine,101697,3226,0.94
16,gp2hdt,1590228581.0,https://www.thelancet.com/journals/lancet/article/PIIS0140-6736(20)31208-3/fulltext,"The first human trial of a COVID-19 vaccine finds that it is safe, well-tolerated, and induces a rapid immune response: “These results represent an important milestone.”",Medicine,97580,2380,0.92
17,dqysmm,1572778018.0,https://newatlas.com/materials/rubbery-crack-resistant-cement/,"Scientists replaced 40 percent of cement with rice husk cinder, limestone crushing waste, and silica sand, giving concrete a rubber-like quality, six to nine times more crack-resistant than regular concrete. It self-seals, replaces cement with plentiful waste products, and should be cheaper to use.",Chemistry,97227,1631,0.95
18,f4998k,1581772506.0,https://www.sciencedirect.com/science/article/pii/S0140673619330193,"A new study in The Lancet by a team of Yale epidemiologists finds that Medicare for All would save more than 68,000 lives annually as well as $450 billion in cost",Health,94796,5420,0.83
19,axd4l4,1551737423.0,https://www.cnn.com/2019/03/04/health/mmr-vaccine-autism-study/index.html,"MMR vaccine does not cause autism, another study confirms",Epidemiology,94081,2552,0.84
20,l44tdt,1611512655.0,https://www.newscientist.com/article/2265680-a-quarter-of-all-known-bee-species-havent-been-seen-since-the-1990s/,A quarter of all known bee species haven't been seen since the 1990s,Animal Science,93396,1693,0.92
21,chwg8s,1564104353.0,https://www.newscientist.com/article/2211209-tree-stumps-that-should-be-dead-can-be-kept-alive-by-nearby-trees/,"Tree stumps that should be dead can be kept alive by nearby trees, discovers new study, which found a tree stump that should have died is being kept alive by neighbouring trees through an interconnected root system, which may change our view from trees as individuals to forests as ‘superorganisms’.",Biology,92353,1914,0.95
22,w8l4b8,1658845417.0,https://www.futurity.org/adults-dont-want-children-childfree-2772742/,One in five adults don’t want children — and they’re deciding early in life,Social Science,92018,9700,0.84
23,izbj3r,1601002070.0,https://www.statnews.com/2020/09/24/crows-possess-higher-intelligence-long-thought-primarily-human/,"Research finds that crows know what they know and can ponder the content of their own minds, a manifestation of higher intelligence and analytical thought long believed the sole province of humans and a few other higher mammals.",Psychology,91850,2839,0.95
24,795tpr,1509136059.0,https://www.nytimes.com/2017/10/26/well/eat/fat-but-fit-the-controversy-continues.html,"Healthy obesity doesn’t exist; obesity is not a benign condition - new study, published in the Journal of the American College of Cardiology, show.",Health,91801,6105,0.86
25,ikivxq,1598961372.0,https://www.abc.net.au/news/2020-09-01/new-aus-research-finds-honey-bee-venom-kills-breast-cancer-cells/12618064,"Venom from honeybees has been found to rapidly kill aggressive and hard-to-treat breast cancer cells, finds new Australian research. The study also found when the venom's main component was combined with existing chemotherapy drugs, it was extremely efficient at reducing tumour growth in mice.",Cancer,91512,1483,0.95
26,eoomwz,1579024189.0,https://today.oregonstate.edu/news/college-students-use-more-marijuana-states-where-it%E2%80%99s-legal-they-binge-drink-less,"Marijuana use among college students has been trending upward for years, but in states that have legalized recreational marijuana, use has jumped even higher. After legalization, however, students showed a greater drop in binge drinking than their peers in states where marijuana is not legal.",Health,90861,3404,0.91
27,ksoppp,1610059079.0,https://academictimes.com/states-with-private-prisons-put-more-people-in-prison-for-longer/,"US states that rely on private prisons incarcerate more people for longer periods of time, according to a first-of-its-kind study that establishes a causal connection between private prisons and incarceration.",Social Science,90645,1731,0.91
28,igmtvw,1598395217.0,https://arstechnica.com/science/2020/08/black-paint-on-wind-turbines-helps-prevent-bird-massacres/,Bird deaths down 70 percent after painting wind turbine blades,Environment,90616,2140,0.84
29,pkkhqa,1631139293.0,https://www.newscientist.com/article/2289334-mrna-cancer-therapy-now-in-human-trials-after-shrinking-mouse-tumours/?utm_term=Autofeed&utm_campaign=echobox&utm_medium=social&utm_source=Twitter#Echobox=1631130377,mRNA cancer therapy now in human trials after shrinking mouse tumours,Biology,90545,2862,0.92
30,jp3w7w,1604664072.0,https://www.nature.com/articles/s41392-020-00374-6,"The first severe COVID-19 patient successfully treated with human recombinant soluble ACE2 (hrsACE2), with disappearance of coronavirus swiftly from the serum, nasal cavity and lungs, and a reduction of inflammatory cytokine levels, leading to a significant clinical improvement.",Medicine,89750,1437,0.93
31,a5li71,1544643515.0,https://www.eurekalert.org/pub_releases/2018-12/aaft-dhs121018.php,"In Seattle, Washington, delaying the start time of two high schools by nearly an hour lengthened students' daily sleep by more than half an hour, and was associated with reduced sleepiness and increased academic performance.",Social Science,89339,2815,0.9
32,jy8knh,1605954071.0,https://www.colorado.edu/today/2020/11/20/frequent-rapid-testing-could-turn-national-covid-19-tide-within-weeks,"Testing half the population weekly with inexpensive, rapid COVID-19 tests would drive the virus toward elimination within weeks, even if the tests are less sensitive than gold-standard. This could lead to “personalized stay-at-home orders” without shutting down restaurants, bars, retail and schools.",Epidemiology,89234,3451,0.83
33,am2056,1549027777.0,https://news.ucsc.edu/2019/01/millardball-vehicles.html,"Self-driving cars will ""cruise"" to avoid paying to park, suggests a new study based on game theory, which found that even when you factor in electricity, depreciation, wear and tear, and maintenance, cruising costs about 50 cents an hour, which is still cheaper than parking even in a small town.",Social Science,89211,6316,0.89
34,admli1,1546897129.0,https://www.jhsph.edu/news/news-releases/2018/us-health-care-spending-highest-among-developed-countries.html,"The United States, on a per capita basis, spends much more on health care than other developed countries; the chief reason is not greater health care utilization, but higher prices, according to a new study from Johns Hopkins.",Health,89161,5274,0.85
35,gl1nvf,1589660574.0,https://www.psypost.org/2020/05/us-population-trusts-scientific-leaders-over-president-trump-when-it-comes-to-covid-19-study-suggests-56782,"U.S. adults look to scientific organizations like the Centers for Disease Control and Prevention, rather than their president, to lead the country’s response to the coronavirus pandemic",Social Science,89054,3263,0.78
36,mm50xh,1617810359.0,https://www.otago.ac.nz/news/news/releases/otago826250.html,"Two thirds of New Zealanders believed there were ‘silver linings’ to the country’s COVID-19 lockdown last year, positive experiences such as pride in the country’s response, more free time to exercise and take up hobbies, flexibility working from home, and reduced time spent commuting.",Health,88576,2537,0.82
37,k2o5a8,1606572183.0,https://journals.sagepub.com/doi/full/10.1177/2167702620951511,Sleep deprivation impairs the suppression of unwanted thoughts and memories which enter conscious awareness when individuals confront reminders. Sleep-deprived people experienced significantly more intrusions and unsuccessful suppressions of unwanted thoughts.,Psychology,88045,1885,0.93
38,67qs7r,1493238165.0,http://www.nbcnews.com/science/science-news/mastodon-bone-findings-could-upend-our-understanding-human-history-n751406,"Paleontologists have dug up a 130,000-year-old mastodon skeleton that looks like it was butchered by humans. But they found it in America, where people were not supposed to have arrived for another 100,000 years. Findings could upend our understanding of human history.",Anthropology,87268,3554,0.93
39,kfulot,1608328598.0,https://www.psypost.org/2020/12/women-overestimate-mens-attraction-to-thin-female-fashion-models-study-finds-58831,"Women overestimate men's attraction to thin female fashion models, study finds",Psychology,87244,5929,0.84
40,kjx2kk,1608892626.0,https://journals.sagepub.com/doi/full/10.1177/0956797620960398,"5- to 9-year-old children chose to save multiple dogs over 1 human, and valued the life of a dog as much as a human. By contrast, almost all adults chose to save 1 human over even 100 dogs. The view that humans are morally more important than animals appears later and may be socially acquired.",Psychology,86776,5107,0.8
41,jih87f,1603728183.0,https://www.independent.co.uk/life-style/gadgets-and-tech/nasa-moon-announcement-today-news-water-lunar-surface-wet-b1346311.html,"Water has been definitively found on the Moon, Nasa has said",Astronomy,86117,1545,0.92
42,bxmxri,1559860113.0,http://news.cornell.edu/stories/2019/06/industrial-methane-emissions-are-100-times-higher-reported-researchers-say,"Industrial methane emissions are 100 times higher than reported, and have been vastly underestimated, finds a new study using a Google Street View car equipped with a high-precision methane sensor. They also were substantially higher than the EPA estimate for all industrial processes in the US.",Environment,85489,2901,0.93
43,qhr9r1,1635439879.0,https://news.wsu.edu/press-release/2021/10/28/poor-parents-receiving-universal-payments-increase-spending-on-kids/,"Study: When given cash with no strings attached, low- and middle-income parents increased their spending on their children. The findings contradict a common argument in the U.S. that poor parents cannot be trusted to receive cash to use however they want.",Economics,84935,3258,0.83
44,eyp2nd,1580817894.0,https://edition.cnn.com/2020/02/04/health/altruistic-infants-wellness/index.html,"Babies, even when hungry, are willing to give a tasty snack to a stranger in need, new study shows. The findings demonstrate that altruism (the act of giving away something desirable, even at a cost to oneself) begins in infancy and suggest that early social experiences can shape altruism.",Social Science,84796,1113,0.92
45,j7w01e,1602236376.0,https://news.sky.com/story/human-microevolution-sees-more-people-born-without-wisdom-teeth-and-an-extra-artery-12099689,Human 'microevolution' sees more people born without wisdom teeth and an extra artery,Biology,84769,4402,0.94
46,91b8gd,1532381748.0,https://news.yale.edu/2018/07/23/even-4-year-olds-dislike-freeloaders,"Children as young as age 4 express dislike of and are willing to punish those who freeload off the work of other group members, a new study has found. But kids also make a clear distinction between those who freeload intentionally and those who have good reasons why they can’t contribute.",Psychology,83999,1810,0.89
47,5vk7pv,1487786409.0,https://www.researchgate.net/blog/post/system-of-seven-earth-like-planets-could-support-life,Seven Earth-sized planets found orbiting an ultracool dwarf star are strong candidates in the search for life outside our solar system.,Astronomy,83685,2848,0.92
48,bisiq5,1556560568.0,https://www.eurekalert.org/pub_releases/2019-04/niom-ro042919.php,"The Netflix show ""13 Reasons Why"" was associated with a 28.9% increase in suicide rates among U.S. youth ages 10-17 in the month (April 2017) following the shows release, after accounting for ongoing trends in suicide rates, according to a study.",Psychology,83633,4649,0.91
49,k92522,1607424447.0,https://www.lsu.edu/mediacenter/news/2020/12/07polisci_gunderson_nature.php,"In 2017, the Trump Administration restored local law enforcement access to military weapons and surplus military equipment that had been prohibited by the Obama Administration. New research shows that this militarization of local law enforcement does not actually reduce crime.",Social Science,83058,3801,0.75
50,gotf27,1590186975.0,https://www.journals.uchicago.edu/doi/abs/10.1086/705718,"Every dollar spent on high-quality, early-childhood programs for disadvantaged children returned $7.3 over the long-term. The programs lead to reductions in taxpayer costs associated with crime, unemployment and healthcare, as well as contribute to a better-prepared workforce.",Economics,82983,1692,0.92
51,cfgou9,1563589855.0,https://www.sciencedirect.com/science/article/pii/S0147651319307481?via%3Dihub,Cigarette butts are the most common form of litter on the planet: 4.5 trillion are littered each year. New research shows that they severely impact plant growth. The presence of cigarette butts reduced root biomass by 57%; germination success by 27%; and shoot length by 28%.,Environment,82553,3107,0.94
52,my6jo7,1619350607.0,https://academictimes.com/stronger-unions-could-help-fight-income-inequality/,"Rising income inequality is not an inevitable outcome of technological progress, but rather the result of policy decisions to weaken unions and dismantle social safety nets, suggests a new study of 14 high-income countries, including Australia, France, Germany, Japan, UK and the US.",Economics,82256,3097,0.77
53,josjux,1604615080.0,https://linkinghub.elsevier.com/retrieve/pii/S1389-9457(20)30418-4,"The ""natural experiment"" caused by the shutdown of schools due to the COVID-19 pandemic led to a 2-h shift in the sleep of developing adolescents, longer sleep duration, improved sleep quality, and less daytime sleepiness compared to those experienced under the regular school-time schedule",Health,82025,1972,0.9
54,7mpvn7,1514499314.0,https://saludmovil.com/adolescents-taking-abstinence-only-sex-ed-more-likely-to-have-unprotected-sex/,Students whose sex ed programs teach abstinence as the only way to protect sexual health have less favorable attitudes toward condoms and are more likely to have unprotected sex than students who learn safe sexual practices. Abstinence-only sex education programs do not stop minors from having sex.,Health,82003,3214,0.8
55,tgkwj0,1647552745.0,https://news.byu.edu/intellect/state-funded-byu-study-finds-elk-are-too-smart-for-their-own-good-and-the-good-of-the-state,Utah's DWR was hearing that hunters weren't finding elk during hunting season. They also heard from private landowners that elk were eating them out of house and home. So they commissioned a study. Turns out the elk were leaving public lands when hunting season started and hiding on private land.,Biology,81901,2590,0.95
56,boc0z4,1557795828.0,http://blogs.discovermagazine.com/d-brief/2019/05/13/tasty-store-bought-tomatoes-are-making-a-comeback/,"Store-bought tomatoes taste bland, and scientists have discovered a gene that gives tomatoes their flavor is actually missing in about 93 percent of modern, domesticated varieties. The discovery may help bring flavor back to tomatoes you can pick up in the produce section.",Biology,81859,2797,0.94
57,ebgos3,1576510809.0,https://doi.org/10.1016/j.jhealeco.2019.102273,Large U.S. study finds that marijuana laws (both recreational & medical) appear to significantly reduce prescription opioid use.,Epidemiology,80867,2027,0.92
58,jbwlhh,1602796896.0,https://www.reddit.com/r/science/comments/jbwlhh/megathread_worlds_most_prestigious_scientific/,[Megathread] World's most prestigious scientific publications issue unprecedented critiques of the Trump administration,News,80117,4479,0.72
59,kuderv,1610280573.0,https://www.asc.upenn.edu/news-events/news/new-study-finds-delivering-news-humor-makes-young-adults-more-likely-remember-and?T=AU,"The rise of comedy-news programs, like Jon Stewart, Stephen Colbert or John Oliver, may actually help inform the public. A new neuroimaging study using fMRI suggests that humor might make news and politics more socially relevant, and therefore motivate people to remember it and share it.",Neuroscience,80072,3306,0.71
60,mdzv54,1616796890.0,https://academictimes.com/elite-philanthropy-mainly-self-serving-2/,"Elite philanthropy mainly self-serving - Philanthropy among the elite class in the United States and the United Kingdom does more to create goodwill for the super-wealthy than to alleviate social ills for the poor, according to a new meta-analysis.",Social Science,79986,4042,0.83
61,jkwwuu,1604065114.0,https://www.aeaweb.org/articles?id=10.1257/pol.20190200,"In 2012, the Obama administration required airlines to show all mandatory fees and taxes in their advertised fares to consumers upfront. This was a massive win for consumers, as airlines were no longer able to pass a large share of the taxes onto consumers. Airlines subsequently lost revenue.",Economics,79807,1865,0.83
62,caoe93,1562608503.0,https://www.cnn.com/2019/07/08/health/recreational-marijuana-laws-teens-study/index.html,"In states where recreational marijuana has been legalized, marijuana use among youth may actually be falling, suggests a new study of 1.4 million high school students. This may be because drug dealers are replaced by licensed dispensaries that require proof of age.",Health,79497,2256,0.9
63,3eret9,1437997348.0,https://www.reddit.com/r/science/comments/3eret9/science_ama_series_i_am_stephen_hawking/,"Science Ama Series: I am Stephen Hawking, theoretical physicist. Join me to talk about making the future of technology more human, reddit. AMA!",Artificial Intelligence AMA,79232,8599,0.91
64,y2439s,1665581552.0,https://www.cfa.harvard.edu/news/weve-never-seen-anything-black-hole-spews-out-material-years-after-shredding-star,‘We’ve Never Seen Anything Like This Before:’ Black Hole Spews Out Material Years After Shredding Star,Astronomy,78996,2790,0.93
65,yi9xu8,1667217898.0,https://www.psypost.org/2022/10/cannabis-use-does-not-increase-actual-creativity-but-does-increase-how-creative-you-think-you-are-study-finds-64187,"Cannabis use does not increase actual creativity but does increase how creative you think you are, study finds",Psychology,78828,4066,0.75
66,ciuld0,1564311894.0,https://www.baylor.edu/mediacommunications/news.php?action=story&story=211538,"Supervisors with ‘bottom-line mentality’ driven by profits to the exclusion of caring about other outcomes, like employee well-being, environment or ethics, could be hurting their bottom lines by losing the respect of their employees, who counter by withholding performance, according to a new study.",Social Science,78797,3510,0.93
67,jnzel5,1604506257.0,https://www.psychnewsdaily.com/new-study-psilocybin-magic-mushrooms-relieves-depression,New study finds psilocybin greatly and quickly relieves depression,Psychology,78734,2960,0.88
68,7opvxp,1515320130.0,https://www.ncbi.nlm.nih.gov/pubmed/29111422,"Sleeping less than the recommended eight hours a night is associated with intrusive, repetitive thoughts like those seen in anxiety or depression, according to new research from Binghamton University, State University of New York.",Psychology,78468,3368,0.87
69,lb5vmc,1612298573.0,https://news.wsu.edu/2021/02/02/big-name-corporations-likely-commit-fraud/,"Big name corporations more likely to commit fraud - Fortune 500 firms with strong growth profiles are more susceptible to “cooking the books” than smaller, struggling companies. This type of elite, white-collar crime is understudied especially when compared with street crime.",Economics,78466,1369,0.91
70,hba8bd,1592466324.0,https://www.mja.com.au/journal/2020/212/11/deleterious-effects-cannabis-during-pregnancy-neonatal-outcomes,"Cannabis use in pregnancy: Researchers discover that continued use of cannabis at 15 weeks of pregnancy was associated with significantly lower birthweight, head circumference, birth length, and gestational age at birth, as well as with more frequent severe neonatal morbidity or death.",Health,78297,4499,0.92
