,id,created_unix_utc,post_url,post_title,flair,score,num_comments,upvote_ratio
0,yql2u5,1668005455.0,https://www.psypost.org/2022/11/attractive-female-students-no-longer-earned-higher-grades-when-classes-moved-online-during-covid-19-64251,Attractive female students no longer earned higher grades when classes moved online during COVID-19,Psychology,123352,4073,0.8
1,w8l4b8,1658845417.0,https://www.futurity.org/adults-dont-want-children-childfree-2772742/,One in five adults don’t want children — and they’re deciding early in life,Social Science,92013,9700,0.84
2,tgkwj0,1647552745.0,https://news.byu.edu/intellect/state-funded-byu-study-finds-elk-are-too-smart-for-their-own-good-and-the-good-of-the-state,Utah's DWR was hearing that hunters weren't finding elk during hunting season. They also heard from private landowners that elk were eating them out of house and home. So they commissioned a study. Turns out the elk were leaving public lands when hunting season started and hiding on private land.,Biology,81908,2590,0.95
3,y2439s,1665581552.0,https://www.cfa.harvard.edu/news/weve-never-seen-anything-black-hole-spews-out-material-years-after-shredding-star,‘We’ve Never Seen Anything Like This Before:’ Black Hole Spews Out Material Years After Shredding Star,Astronomy,78994,2790,0.93
4,yi9xu8,1667217898.0,https://www.psypost.org/2022/10/cannabis-use-does-not-increase-actual-creativity-but-does-increase-how-creative-you-think-you-are-study-finds-64187,"Cannabis use does not increase actual creativity but does increase how creative you think you are, study finds",Psychology,78828,4066,0.75
5,rgekj2,1639508472.0,https://edition.cnn.com/2021/12/13/health/logic-song-suicide-prevention-wellness/index.html,"Logic's song '1-800-273-8255' saved lives from suicide, study finds. Calls to the suicide helpline soared by 50% with over 10,000 more calls than usual, leading to 5.5% drop in suicides among 10 to 19 year olds — that's about 245 less suicides than expected within the same period",Health,75683,1233,0.9
6,yt4yf8,1668253952.0,https://news.yale.edu/2022/07/05/insulin-extreme-financial-burden-over-14-americans-who-use-it,"For more than 14% of people who use insulin in the U.S., insulin costs consume at least 40% of their available income, a new study finds",Health,75016,2580,0.93
7,ren6cc,1639308430.0,https://www.japantimes.co.jp/news/2021/12/12/national/science-health/aging-vaccine/,"Japanese scientists create vaccine for aging to eliminate aged cells, reversing artery stiffening, frailty, and diabetes in normal and accelerated aging mice",Biology,74211,2097,0.92
8,umfeu7,1652177874.0,https://news.mit.edu/2022/poverty-trap-bangladesh-0510,"Springing people from the poverty trap. Research suggests poverty is not principally the product of people’s capabilities or attitudes. Rather, the very poor are usually mired in a poverty trap, in which an initial lack of resources prevents them from improving their circumstances",Health,72631,3233,0.88
9,uq4yc8,1652617318.0,https://news.ki.se/video-games-can-help-boost-childrens-intelligence,"Scientists have found children who spent an above-average time playing video games increased their intelligence more than the average, while TV watching or social media had neither a positive nor a negative effect",Neuroscience,72250,2325,0.84
10,t3o15q,1646077487.0,https://www.inverse.com/science/america-road-salt-hurting-ecosystems-drinking-water,"Study reveals road salt is increasing salinization of lakes and killing zooplankton, harming freshwater ecosystems that provide drinking water in North America and Europe:",Environment,69098,2296,0.94
11,vwj08w,1657547677.0,https://www.psychnewsdaily.com/reaching-out-more-appreciated-than-assumed/,New study finds that people consistently underestimate how much others appreciate having an old friend unexpectedly reach out to them.,Social Science,67278,1041,0.93
12,xyp1d7,1665223790.0,http://jhr.uwpress.org/content/early/2022/10/03/jhr.0222-12169R2.abstract,"In 2007, NASCAR switched from leaded to unleaded fuel. After the switch, children who were raised near racetracks began performing substantially better in school than earlier cohorts. There were also increases in educational performance relative to students further away.",Health,66925,1924,0.93
13,xk2ish,1663760441.0,https://www.psypost.org/2022/09/boys-and-men-experience-more-social-isolation-than-girls-and-women-study-finds-63947,"Boys and men experience more social isolation than girls and women, study finds",Psychology,65632,5076,0.84
14,sjlxox,1643901961.0,https://www.eurekalert.org/news-releases/942244,"Long-term cannabis use damages lungs, but in a different way to tobacco. Prolonged cannabis use led to over-inflated lungs and increased the resistance to airflow to a greater extent than tobacco and may also impair the ability of the lungs to extract oxygen from the breath.",Medicine,65545,7302,0.86
15,v0n9bl,1653867381.0,https://www.sciencedirect.com/science/article/abs/pii/S0002961022002057,The Federal Assault Weapons Ban of 1994 significantly lowered both the rate *and* the total number of firearm related homicides in the United States during the 10 years it was in effect,Health,64503,6127,0.62
16,zgzchr,1670597628.0,https://www.eurekalert.org/news-releases/973474,Greta Thunberg effect evident among Norwegian youth. Norwegian youth from all over the country and across social affiliations cite teen activist Greta Thunberg as a role model and source of inspiration for climate engagement,Social Science,64066,2264,0.75
17,ulyz57,1652124118.0,https://www.uts.edu.au/news/health-science/better-diet-helps-beat-depression-young-men,"Young men with a poor diet saw a significant improvement in their symptoms of depression when they switched to a healthy Mediterranean diet. The diet used in the study was rich in colourful vegetables, legumes and wholegrains, oily fish, olive oil and raw, unsalted nuts.",Neuroscience,63689,2496,0.9
18,su3fkm,1645037951.0,https://www.nyu.edu/about/news-publications/news/2022/february/federally-funded-sex-education-programs-linked-to-decline-in-tee.html,"Federally funded sex education programs linked to decline in teen birth rates, new study shows.",Social Science,63620,1248,0.89
19,zj2d4g,1670782495.0,https://www.psypost.org/2022/12/when-women-do-more-household-labor-they-see-their-partner-as-a-dependent-and-sexual-desire-dwindles-64497,"When women do more household labor, they see their partner as a dependent and sexual desire dwindles, study finds",Psychology,71144,6759,0.78
20,sx06y3,1645359961.0,https://www.aeaweb.org/research/school-spending-student-outcomes-wisconsin,"The US has increased its funding for public schools. New research shows additional spending on operations—such as teacher salaries and support services—positively affected test scores, dropout rates, and postsecondary enrollment. But expenditures on new buildings and renovations had little impact.",Economics,63298,1888,0.89
21,uhmvb1,1651603432.0,https://www.pnas.org/doi/10.1073/pnas.2123177119,"Since the 1980s, incoming Republican administrations immediately block US funding for foreign family planning organizations that provide abortion counseling. The policy is linked to higher maternal and child mortality rates, as well as more unwanted pregnancies and higher HIV incidence rates.",Health,63060,2743,0.74
22,sscxpw,1644851709.0,https://amp.cnn.com/cnn/2022/02/14/health/valentines-day-love-marriage-relationships-wellness/index.html,"Twenty-six percent of Americans ages 18 and up didn't have sex once over the past 12 months, according to the 2021 General Social Survey.",Health,62764,9076,0.87
23,uqqtmy,1652688530.0,https://www.nature.com/articles/s41598-022-10261-5,"Cats learn the names of their friend cats in their daily lives. In a new study, scientists discovered that in addition to knowing their own names, cats also appear to recognize the names of other cats they're familiar with, and may also know the names of people who live in the same household.",Animal Science,61730,1470,0.93
24,y5xy90,1665970586.0,https://www.psypost.org/2022/10/new-study-identifies-an-increasing-disinterest-in-fatherhood-among-childless-men-in-the-united-states-64072,New study identifies an increasing disinterest in fatherhood among childless men in the United States,Psychology,60760,9765,0.87
25,ycqb2v,1666655246.0,https://www.nih.gov/news-events/news-releases/video-gaming-may-be-associated-better-cognitive-performance-children,"A study of nearly 2,000 children found that those who reported playing video games for three hours per day or more performed better on cognitive skills tests involving impulse control and working memory compared to children who had never played video games.",Health,60629,2008,0.86
26,wxxzsn,1661483852.0,https://newatlas.com/energy/aluminum-sulfur-salt-battery-fast-safe-low-cost/,"Engineers at MIT have developed a new battery design using common materials – aluminum, sulfur and salt. Not only is the battery low-cost, but it’s resistant to fire and failures, and can be charged very fast, which could make it useful for powering a home or charging electric vehicles.",Engineering,60572,1878,0.9
27,uh8eiv,1651553097.0,https://onlinelibrary.wiley.com/doi/full/10.1111/pops.12803,"In the US, 43.8% are consistently ""pro-choice"", 14.8% are consistently ""pro-life"" while others have context-dependent views. Age, religiosity, and conservatism correlate negatively with abortion support. The strongest predictor of anti-abortion views is sexism and belief in traditional gender-roles.",Social Science,60061,4387,0.73
28,yk1uzi,1667385962.0,https://edition.cnn.com/2022/11/01/health/drinking-deaths-us-study-wellness/index.html,"1 in 5 deaths of US adults 20 to 49 is from excessive drinking, study shows | CNN",Health,58946,3209,0.91
29,xrd53i,1664471063.0,https://www.eurekalert.org/news-releases/966192,"Bitcoin mining is just as bad for the environment as drilling for oil. Each coin mined in 2021 caused $11,314 of climate damage, adding to the total global damages that exceeded $12 billion between 2016 and 2021.",Environment,58598,5530,0.7
30,todfih,1648260462.0,https://www.cuimc.columbia.edu/news/new-type-ultraviolet-light-makes-indoor-air-safe-outdoors,A new type of ultraviolet light that is safe for people took less than five minutes to reduce the level of indoor airborne microbes by more than 98%.,Engineering,58494,1647,0.92
31,tpu5zx,1648417932.0,https://www.inverse.com/mind-body/study-links-artificial-sweeteners-to-cancer,"Researchers combed through more than a decade of health data from 102,865 French volunteers. They found that consumption of artificial sweeteners was associated with an increased risk of cancer.",Health,58207,2086,0.86
32,w5kiho,1658521710.0,https://news.northwestern.edu/stories/2022/07/false-balance-reporting-climate-change-crisis/,"The argument that climate change is not man made has been incontrovertibly disproven by science, yet many Americans believe that the global crisis is either not real, not of our making, or both, in part because the news media has given deniers a platform in the name of balanced reporting",Psychology,58019,3257,0.79
33,vrvrmb,1657020931.0,https://news.osu.edu/more-dogs-in-the-neighborhood-often-means-less-crime/,"More dogs in a neighborhood linked to less crime, study finds. Results suggest dog walkers act as patrols, discouraging crime, at least when residents have high levels of trust in each other.",Social Science,57928,1477,0.89
34,vr4ncw,1656931683.0,https://www.psypost.org/2022/07/tattoos-and-piercings-are-more-common-among-those-who-experienced-childhood-abuse-and-neglect-63440,A study found that tattoos and piercings are more common among those who experienced childhood abuse and neglect,Psychology,57762,2812,0.83
35,xlxul7,1663940271.0,https://doi.org/10.1093/qje/qjac037,"Data from 35 million traffic stops show that the probability that a stopped driver is Black increases by 5.74% after Trump 2016 campaign rallies. ""The effect is immediate, specific to Black drivers, lasts for up to 60 days after the rally, and is not justified by changes in driver behavior.""",Social Science,57430,2874,0.7
36,rvxuwe,1641312421.0,https://www.psypost.org/2022/01/people-who-are-obsessed-with-celebrities-tend-to-score-lower-on-measures-of-cognitive-ability-62314,"People who are obsessed with celebrities tend to score lower on measures of cognitive ability: ""“Our results also support previous findings showing that excessive behaviors such as celebrity worshiping can possibly impair cognitive functioning""",Psychology,57333,2255,0.85
37,w13pvo,1658050879.0,https://www.colorado.edu/today/2022/07/15/amid-climate-change-and-conflict-more-resilient-food-systems-must-report-shows,"Increased demand for water will be the No. 1 threat to food security in the next 20 years, followed closely by heat waves, droughts, income inequality and political instability, according to a new study which calls for increased collaboration to build a more resilient global food supply.",Environment,57157,2114,0.91
38,ts6rr8,1648647858.0,https://news.osu.edu/americans-love-football-but-differ-on-whether-kids-should-play/,"Half of Americans now think tackle football is not appropriate for kids to play. Conservatives, Christians and those with more traditionalist values were more likely to say football was still appropriate for youth.",Social Science,57023,6786,0.73
39,z6yfhp,1669646858.0,https://www.aeaweb.org/articles?id=10.1257/aer.20181805,"White South-African students who were randomly allocated to share a dorm room with black students were less likely to express negative stereotypes of Blacks and more likely to form interracial friendships, while the black students improved their GPA, passed more exams and had lower dropout rates.",Social Science,56890,1818,0.86
40,xy7127,1665168693.0,https://www.hhs.gov/about/news/2022/10/07/new-hhs-report-covid-19-vaccinations-in-2021-linked-to-more-than-650000-fewer-covid-19-hospitalizations.html,"Covid vaccines prevented at least 330,000 deaths and nearly 700,000 hospitalizations among adult Medicare recipients in 2021. The reduction in hospitalizations due to vaccination saved more than $16 billion in medical costs",Health,56201,3492,0.71
41,yd7gmo,1666711321.0,https://www.psypost.org/2022/10/having-more-time-to-oneself-is-the-top-reported-benefit-of-being-single-study-finds-64145,"Having more time to oneself is the top reported benefit of being single, study finds",Social Science,55603,2052,0.87
42,x826qa,1662548610.0,https://www.mpg.de/19168412/how-does-nature-nurture-the-brain,An hour-long stroll in nature helps decrease activity in an area of the brain associated with stress processing,Psychology,55526,1115,0.94
43,rzwawc,1641748421.0,https://onlinelibrary.wiley.com/doi/10.1111/1745-9125.12298,"Most White Americans feel safe in interacting with police whereas most Black Americans feared that police would kill them and hurt their family. ""Approximately half of Black respondents preferred to be robbed or burglarized than to have unprovoked contact with officers.""",Social Science,55178,4282,0.73
44,s6v3su,1642504194.0,https://www.theguardian.com/environment/2022/jan/18/chemical-pollution-has-passed-safe-limit-for-humanity-say-scientists,"Chemical pollution has passed safe limit for humanity, say scientists",Environment,55114,3912,0.89
45,sojte5,1644429868.0,https://brighterworld.mcmaster.ca/articles/researchers-confirm-newly-developed-inhaled-vaccine-delivers-broad-protection-against-sars-cov-2-variants-of-concern/,"Scientists have developed an inhaled form of COVID vaccine. It can provide broad, long-lasting protection against the original strain of SARS-CoV-2 and variants of concern. Research reveals significant benefits of vaccines being delivered into the respiratory tract, rather than by injection.",Medicine,54973,2813,0.86
46,ubtj8t,1650915682.0,https://www.sciencenews.org/article/black-hole-gravitational-waves-kick-ligo-merger-spacetime,"Scientists recently observed two black holes that united into one, and in the process got a “kick” that flung the newly formed black hole away at high speed. That black hole zoomed off at about 5 million kilometers per hour, give or take a few million. The speed of light is just 200 times as fast.",Physics,54876,2736,0.94
47,smns3m,1644232441.0,https://www.timesofisrael.com/israeli-lab-made-spinal-cords-get-paralyzed-mice-walking-human-trial-in-3-years/,"Scientists make paralyzed mice walk again by giving them spinal cord implants. 12 out of 15 mice suffering long-term paralysis started moving normally. Human trial is expected in 3 years, aiming to ‘offer all paralyzed people hope that they may walk again’",Engineering,54632,1265,0.95
48,xoad86,1664170620.0,https://www.scimex.org/newsfeed/most-gen-z-say-climate-change-is-caused-by-humans-but-few-recognise-the-climate-impact-of-meat-consumption,"Generation Z – those born after 1995 – overwhelmingly believe that climate change is being caused by humans and activities like the burning of fossil fuels, deforestation and waste. But only a third understand how livestock and meat consumption are contributing to emissions, a new study revealed.",Environment,54488,3341,0.67
49,vcqtaf,1655286445.0,https://www.latrobe.edu.au/news/articles/2022/release/childrens-chores-improve-brain-function,"Requiring your kids to do chores on a regular basis may be associated with them having better academic performance and problem solving skills. Regular chores were associated with better executive functions – planning, self-regulation, switching between tasks and remembering instructions.",Neuroscience,54470,1294,0.91
50,ugs9rh,1651505532.0,https://www.cambridge.org/core/journals/american-political-science-review/article/effect-of-gender-on-interruptions-at-congressional-hearings/DDD33F28A1C8ED9C162E1793D8126243,"Women in Congress are about 10% more likely to be interrupted in Senate committees than men. When discussing women's issues, women are more than twice as likely to be interrupted than on other issues.",Social Science,54271,1722,0.7
51,t9fut4,1646742872.0,https://science.ku.dk/english/press/news/2022/pig-grunts-reveal-their-emotions/,"We can now decode pigs’ emotions. Using thousands of acoustic recordings gathered throughout the lives of pigs, from their births to deaths, an international team is the first in the world to translate pig grunts into actual emotions across an extended number of conditions and life stages",Animal Science,53949,2699,0.92
52,xe7mq4,1663175822.0,https://www.ucsf.edu/news/2022/09/423661/drug-turns-cancer-gene-eat-me-flag-immune-system,Drug Turns Cancer Gene Into “Eat Me” Flag for Immune System | UCSF-Led Study Shows Promising Pre-Clinical Results in Killing Cancer Cells Resistant to Current KRAS-Targeted Treatments,Medicine,53422,659,0.94
53,ttxivt,1648836883.0,https://ihpi.umich.edu/news/half-older-adults-now-die-dementia-diagnosis-sharply,"Nearly half of all older adults now die with a diagnosis of dementia listed on their medical record, up 36% from two decades ago, new study shows",Health,53420,2867,0.93
54,ufzcye,1651409884.0,https://med.stanford.edu/news/all-news/2022/04/teenager-brain-mother-voice.html,"Around age 13, kids’ brains shift from focusing on their mothers’ voices to favor new voices, part of the biological signal driving teens to separate from their parents, a Stanford Medicine study has found.",Neuroscience,53398,664,0.94
55,rmsh69,1640253951.0,https://digest.bps.org.uk/2021/12/21/watching-a-lecture-twice-at-double-speed-can-benefit-learning-better-than-watching-it-once-at-normal-speed/,Study: Watching a lecture twice at double speed can benefit learning better than watching it once at normal speed. The results offer some guidance for students at US universities considering the optimal revision strategy.,Psychology,53345,993,0.9
56,t64qbs,1646350003.0,https://www.frontiersin.org/articles/10.3389/fnins.2022.758575/full,Tinnitus disappeared or significantly reduced: Integrative Treatment for Tinnitus Combining Repeated Facial and Auriculotemporal Nerve Blocks With Stimulation of Auditory and Non-auditory Nerves.,Health,53297,2730,0.95
57,ueoe8i,1651246011.0,https://www.aeaweb.org/articles?id=10.1257/pol.20190299,"Since 1982, all Alaskan residents have received a yearly cash dividend from the Alaska Permanent Fund. Contrary to some rhetoric that recipients of cash transfers will stop working, the Alaska Permanent Fund has had no adverse impact on employment in Alaska.",Economics,53281,1789,0.86
58,xistr8,1663631437.0,https://doi.org/10.1093/oxrep/grac012,Refugees are inaccurately portrayed as a drain on the economy and public coffers. The sharp reduction in US refugee admissions since 2017 has cost the US economy over $9.1 billion per year and cost public coffers over $2.0 billion per year.,Economics,53082,2992,0.71
59,xlgo85,1663888728.0,https://news.stanford.edu/2022/09/22/wildfire-smoke-unraveling-decades-air-quality-gains/,"Stanford researchers find wildfire smoke is unraveling decades of air quality gains, exposing millions of Americans to extreme pollution levels",Environment,53013,1315,0.91
60,v2dcbj,1654077435.0,https://www.eawag.ch/en/news-agenda/news-portal/news-detail/water-treatment-plants-would-be-ready-for-the-removal-of-nanoplastics,"Water treatment plants would be ready for the removal of nanoplastics. Both in laboratory tests and in a larger test facility, the biologically active slow sand filter was the most effective at retaining nanoparticles – achieving an efficacy level in the region of 99.9%.",Environment,52961,778,0.95
61,v6cifz,1654546502.0,https://www.pnas.org/doi/10.1073/pnas.2120284119,"Since 2020, the US Supreme Court has become much more conservative than the US public on policy issues. Prior to 2020, the court's position was quite close to the average American. The divergence happened when Brett Kavanaugh became the court’s median justice upon the appointment Amy Coney Barrett.",Social Science,52929,2966,0.7
62,xfu5en,1663341560.0,https://onlinelibrary.wiley.com/doi/10.1111/iju.15004,Female emission at orgasm (squirting) confirmed in new study to release fluid from the bladder.,Biology,52421,6244,0.84
63,tp46xr,1648328945.0,https://aip.scitation.org/doi/10.1063/5.0087175,A physicist has designed an experiment – which if proved correct – means he will have discovered that information is the fifth form of matter. His previous research suggests that information is the fundamental building block of the universe and has physical mass.,Physics,52242,2966,0.84
64,y6kmu8,1666036062.0,https://www.psypost.org/2022/10/victims-of-childhood-abuse-are-biologically-older-than-their-peers-in-midlife-study-indicates-64085,"Victims of childhood abuse are biologically older than their peers in midlife, study indicates",Psychology,51892,1949,0.92
65,wb27h0,1659093710.0,https://news.rub.de/english/press-releases/2022-07-21-biology-early-alzheimers-detection-17-years-advance,Early Alzheimer’s detection up to 17 years in advance. A sensor identifies misfolded protein biomarkers in the blood. This offers a chance to detect Alzheimer's disease before any symptoms occur. Researchers intend to bring it to market maturity.,Neuroscience,51419,1496,0.94
66,wp3t34,1660580498.0,https://www.nature.com/articles/d41586-022-02219-4,"Nuclear war would cause global famine with more than five billion people killed, new study finds",Social Science,50960,4378,0.85
67,uzs74s,1653759363.0,https://www.cam.ac.uk/stories/genyornis,"Ancient proteins confirm that first Australians, around 50,000, ate giant melon-sized eggs of around 1.5 kg of huge extincted flightless birds",Anthropology,50727,1776,0.91
68,rjv2i1,1639913927.0,https://news.cornell.edu/stories/2021/12/shifting-meetings-conventions-online-curbs-climate-change,"The pandemic has shown a new way to reduce climate change: scrap in-person meetings & conventions. Moving a professional conference completely online reduces its carbon footprint by 94%, and shifting it to a hybrid model, with no more than half of conventioneers online, curtails the footprint to 67%",Environment,50630,2011,0.78
69,wts44s,1661061607.0,https://theconversation.com/dont-blame-women-for-low-libido-sexual-sparks-fly-when-partners-do-their-share-of-chores-including-calling-the-plumber-185401,"Study, published in the Journal of Sex Research, shows women in equal relationships (in terms of housework and the mental load) are more satisfied with their relationships and, in turn, feel more sexual desire than those in unequal relationships.",Anthropology,49802,2603,0.85
70,tm4ga8,1648123653.0,https://www.psypost.org/2022/03/ignorance-of-history-may-partly-explain-why-republicans-perceive-less-racism-than-democrats-62774,Ignorance of history may partly explain why Republicans perceive less racism than Democrats,Psychology,49650,5371,0.61
71,upd1ip,1652517792.0,https://e360.yale.edu/digest/microplastics-found-in-lungs-of-humans-undergoing-surgery,"Microplastics Found In Lungs of People Undergoing Surgery. A new study has found tiny plastic particles no bigger than sesame seeds buried throughout human lungs, indicating that people are inhaling microplastics lingering in the air.",Health,49651,2127,0.94
72,xnntlq,1664113624.0,https://reutersinstitute.politics.ox.ac.uk/how-news-feels-anticipated-anxiety-factor-news-avoidance-and-barrier-political-engagement,"Study found that who avoids the news do it in part because they anticipate news will make them anxious without being relevant to their lives, resulting in limited engagement with news, and by extension, civic and political affairs",Social Science,49634,1956,0.85
